{
  "name": "knowledge-base",
  "displayName": "Knowledge Base",
  "version": "0.3.1",
  "description": "Knowledge base workflows for capturing, organizing, retrieving, and maintaining reusable domain knowledge.",
  "author": {
    "name": "Brian Weisberg"
  },
  "homepage": "https://github.com/weisberg/agile_agentic_analytics/tree/main/plugins/knowledge-base",
  "repository": "https://github.com/weisberg/agile_agentic_analytics",
  "license": "MIT",
  "keywords": [
    "knowledge-base",
    "knowledge-management",
    "documentation",
    "research",
    "retrieval",
    "ask-user",
    "choice-gate",
    "ingest",
    "knowledge-ingestion",
    "source-preservation",
    "vaultli",
    "gemsearch",
    "embeddinggemma-2",
    "local-semantic-search",
    "vault",
    "frontmatter",
    "sidecars",
    "indexing",
    "skillify",
    "skill-development",
    "evals",
    "strategic-reading",
    "applied-analysis",
    "playbooks",
    "workflow",
    "resolver",
    "query",
    "graph-ops",
    "citations",
    "raw-sources",
    "privacy",
    "automation",
    "sample-vault",
    "plugin-manager",
    "upstream-sync"
  ],
  "skills": "./skills/",
  "defaultEnabled": true
}
