{
  "name": "marketing-analytics",
  "displayName": "Marketing Analytics",
  "version": "1.0.0",
  "description": "Fifteen interconnected marketing analytics skills for attribution, experimentation, paid media, reporting, CLV, segmentation, funnels, email, web analytics, SEO, CRM, social, competitive intel, VoC, and compliance review.",
  "author": {
    "name": "Brian Weisberg"
  },
  "homepage": "https://github.com/weisberg/agile_agentic_analytics/tree/main/plugins/marketing-analytics",
  "repository": "https://github.com/weisberg/agile_agentic_analytics",
  "license": "MIT",
  "keywords": [
    "marketing",
    "analytics",
    "attribution",
    "experimentation",
    "paid-media",
    "reporting",
    "clv",
    "segmentation",
    "funnel",
    "email",
    "web-analytics",
    "seo",
    "crm",
    "social-media",
    "competitive-intelligence",
    "voice-of-customer",
    "compliance",
    "financial-services"
  ],
  "skills": "./skills/",
  "defaultEnabled": true
}
