{
  "name": "campaign-analysis",
  "displayName": "Campaign Analysis",
  "version": "0.1.1",
  "description": "Campaign performance analysis toolkit for measurement, diagnostics, optimization, and stakeholder reporting.",
  "author": {
    "name": "Brian Weisberg"
  },
  "homepage": "https://github.com/weisberg/agile_agentic_analytics/tree/main/plugins/campaign-analysis",
  "repository": "https://github.com/weisberg/agile_agentic_analytics",
  "license": "MIT",
  "keywords": [
    "campaign-analysis",
    "campaign-performance",
    "marketing",
    "analytics",
    "measurement",
    "optimization",
    "reporting"
  ],
  "skills": "./skills/",
  "defaultEnabled": true
}
