{
  "name": "product-manager",
  "displayName": "Product Manager",
  "version": "0.1.0",
  "description": "Product management toolkit for discovery, prioritization, roadmapping, PRDs, and stakeholder communication.",
  "author": {
    "name": "Brian Weisberg"
  },
  "homepage": "https://github.com/weisberg/agile_agentic_analytics/tree/main/plugins/product-manager",
  "repository": "https://github.com/weisberg/agile_agentic_analytics",
  "license": "MIT",
  "keywords": [
    "product-management",
    "roadmap",
    "prioritization",
    "discovery",
    "prd"
  ],
  "skills": "./skills/",
  "defaultEnabled": true
}
